{
  "$ref": "#/definitions/books",
  "definitions": {
    "books": {
      "type": "object",
      "properties": {
        "title": {
          "type": "string"
        },
        "author": {
          "type": "string"
        },
        "year": {
          "type": "string"
        },
        "genre": {
          "type": "string"
        },
        "tag": {
          "type": "string"
        },
        "note": {
          "type": "string"
        },
        "links": {
          "type": "array",
          "items": {
            "type": "object",
            "properties": {
              "label": {
                "type": "string"
              },
              "url": {
                "type": "string"
              },
              "icon": {
                "type": "string"
              },
              "disabled": {
                "type": "boolean"
              },
              "class": {
                "type": "string"
              }
            },
            "required": [
              "label",
              "url"
            ],
            "additionalProperties": false
          }
        },
        "$schema": {
          "type": "string"
        }
      },
      "required": [
        "title",
        "author",
        "note"
      ],
      "additionalProperties": false
    }
  },
  "$schema": "http://json-schema.org/draft-07/schema#"
}