[
    {
        "title": "Titel på bog",
        "author": "Forfatter",
        "year": "årstal",
        "genre": "Genre",
        "tag": "Klassiker",
        "note": "Hvad gav den mig? Én sætning. (fx “skarpt blik for menneskelig absurditet og moral”.)",
        "links": [
            {
                "label": "Citat",
                "url": "#",
                "icon": "fa-solid fa-quote-left",
                "disabled": true
            },
            {
                "label": "Mini-note",
                "url": "#",
                "icon": "fa-solid fa-pen",
                "disabled": true
            }
        ]
    },
    {
        "title": "Titel på bog",
        "author": "Forfatter",
        "year": "årstal",
        "genre": "Økonomi/Data",
        "tag": "Fagligt",
        "note": "Hvad lærte jeg? (fx “god til intuition + konkrete eksempler, uden at blive fluff”.)",
        "links": [
            {
                "label": "Link",
                "url": "#",
                "icon": "fa-solid fa-link",
                "disabled": true
            },
            {
                "label": "Takeaways",
                "url": "#",
                "icon": "fa-solid fa-notes-medical",
                "disabled": true
            }
        ]
    },
    {
        "title": "Titel på bog",
        "author": "Forfatter",
        "year": "årstal",
        "genre": "Refleksion",
        "tag": "Tro & etik",
        "note": "Hvorfor betyder den noget? (fx “en bog jeg vender tilbage til i perioder”.)",
        "links": [
            {
                "label": "Favoritkapitel",
                "url": "#",
                "icon": "fa-solid fa-bookmark",
                "disabled": true
            },
            {
                "label": "Noter",
                "url": "#",
                "icon": "fa-solid fa-comment",
                "disabled": true
            }
        ]
    },
    {
        "title": "Titel på bog",
        "author": "Forfatter",
        "year": "årstal",
        "genre": "Person/Emne",
        "tag": "Biografi",
        "note": "Hvad inspirerede den? (fx “arbejdsmoral, retning, eller bare et godt livsportræt”.)",
        "links": [
            {
                "label": "Highlights",
                "url": "#",
                "icon": "fa-solid fa-star",
                "disabled": true
            }
        ]
    },
    {
        "title": "Titel på bog",
        "author": "Forfatter",
        "year": "årstal",
        "genre": "Stil/Kommunikation",
        "tag": "Skrivning",
        "note": "Hvilken teknik tog jeg med? (fx “klarhed, struktur, og “cut the fluff””.)",
        "links": [
            {
                "label": "Regler jeg bruger",
                "url": "#",
                "icon": "fa-solid fa-scissors",
                "disabled": true
            }
        ]
    },
    {
        "title": "Titel på bog",
        "author": "Forfatter",
        "year": "årstal",
        "genre": "Roman",
        "tag": "Klassiker",
        "note": "Hvad gør den stærk? (fx “dialog, tempo, humor, og det der ligger mellem linjerne”.)",
        "links": [
            {
                "label": "Temaer",
                "url": "#",
                "icon": "fa-solid fa-masks-theater",
                "disabled": true
            }
        ]
    }
]